Utilidad de operador &ldquo; ~ &rdquo; en CSS,1 ,2 ,16 
Como hacer para que un componente de boostrap se quede fijo,0 ,1 ,12 
JavaScript - Sustituir imagen dentro de una tabla utilizando document.getElementByTagName,1 ,0 ,16 
Imagen responsive background en móviles,0 ,2 ,339 
Figura Modernista con CSS,0 ,1 ,25 
Alinear/Centrar Calendar Chart Google,0 ,1 ,12 
Por qué no se me organizan en horizontal los items con flex box?,0 ,0 ,16 
Problema en diseño responsive con Bootstrap y Jquery-UI Draggable,0 ,0 ,9 
¿Porque mi párrafo se sale de los limites de un elemento?,2 ,1 ,24 
Comprensión de función javascript,2 ,2 ,22 
Se muestra un espacio debajo del fooder en algunos moviles y quiero eliminarlo,0 ,0 ,24 
Problemas con css en cambiar color y se queda cargando la pagina,0 ,0 ,19 
problema al utilizar height 100% en una aplicación usando electron,0 ,2 ,129 
Aplicar estilo solo a text Jqgrid,0 ,0 ,9 
