Cómo truncar un numero a 2 decimales en Javascript,3 ,4 ,6k 
Api Rest; metodo get; como pasar parametros de tipo array,0 ,1 ,347 
Problema con .width(),0 ,1 ,19 
sumar o dividir y que el resultado sea con dos decimales pero sin redondear javacript,0 ,3 ,24 
JavaScript - Sustituir imagen dentro de una tabla utilizando document.getElementByTagName,1 ,0 ,16 
contenido de navbar desaparece al hacer clic cuando colapsa,0 ,0 ,6 
Calcular el área de un triángulo,2 ,1 ,75 
Como pasar variables a esta funcion y extraer datos de una funcion? Javascript,0 ,1 ,14 
Reemplazar texto con JQuery?,0 ,1 ,49 
Crear tabla HTML con Javascript,0 ,1 ,32 
Calcular MCD y mcm con javascript,0 ,0 ,21 
WebScraping con Casperjs,0 ,0 ,11 
Como actualizar una variable asíncrona en la vista en angular?,0 ,1 ,348 
¿Como uso sockets.io y express en mi pagina web?,-1 ,0 ,17 
