Failed to resolve al compilar librería en android,1 ,1 ,10 
Inicializar interface,0 ,1 ,23 
Modificar el archivo string.xml desde codigo java,0 ,1 ,22 
¿ Cómo quitar totalmente la &ldquo;status bar&rdquo; y modificarla?,2 ,3 ,513 
Librerias vs llamadas al sistema,-1 ,1 ,22 
Convertir posiciones de una cadena a fecha en java,1 ,3 ,373 
Not supported for select queries HIBERNATE+JAVA+HQL,1 ,0 ,15 
Problema al descargar un xml para después mostrar,-1 ,1 ,17 
Transferencia de archivos incorrecta en Java,0 ,0 ,25 
¿Cómo puedo ocultar y mostrar un WebView mediante un botón en un Fragment? Android Studio,0 ,2 ,346 
Error: Variable auxi is already defined in method main (String[]),0 ,1 ,346 
Cargar datos en tabPane desde java,0 ,0 ,7 
&ldquo;Hace cuento tiempo&rdquo; en Java,0 ,2 ,32 
Quiero ordenar usuarios por edad usando su Carnet de Identidad,-2 ,1 ,34 
